{
  "event_id": "evt-123",
  "occurred_at": "2026-08-19T10:00:00Z",
  "device": {
    "host_name": "developer-mac",
    "platform": "macos",
    "os_version": "15.6"
  },
  "agent": {
    "name": "codex",
    "version": "1.2.3"
  },
  "session_id": "session-123",
  "turn_id": "turn-123",
  "claude_code_billing": {
    "cc_entrypoint": "cli",
    "cc_prompt_id": "a7e7449e-3401-4091-9857-98c73e217ce3",
    "cc_turn_index": "13",
    "cc_version": "2.1.293.af3"
  },
  "claude_thread": {
    "type": "continue",
    "previous_message_id": "msg_123"
  },
  "llm": {
    "provider": "openai",
    "model": "gpt-5"
  },
  "side": "response",
  "text": "I will inspect the repository.",
  "token_usage": {
    "input_tokens": 0,
    "output_tokens": 12,
    "cache_read_tokens": 0,
    "cache_write_tokens": 0,
    "reasoning_tokens": 4,
    "total_tokens": 12
  },
  "tool_calls": [
    {
      "call_id": "call-123",
      "name": "exec",
      "input": "pwd",
      "input_sha256": "0000000000000000000000000000000000000000000000000000000000000000"
    }
  ],
  "attachments": [
    {
      "position": 0,
      "media_type": "image/png",
      "byte_size": 8,
      "sha256": "0000000000000000000000000000000000000000000000000000000000000000",
      "content_base64": "iVBORw0KGgo="
    }
  ],
  "conversation": {
    "messages": [
      {
        "id": "rs-123",
        "role": "reasoning",
        "text": "The user wants an overview of the repository."
      },
      {
        "id": "msg-123",
        "role": "assistant",
        "text": "I will inspect the repository."
      },
      {
        "id": "fc-123",
        "role": "tool",
        "text": ""
      }
    ],
    "previous_response_id": null,
    "thread_source": null,
    "instructions_present": false,
    "completeness": "complete",
    "policy_omitted": false
  }
}
